{
  "$schema": "http://json-schema.org/draft-07/schema#",
  "$id": "urn:nansen:schema:fileAdapter",
  "title": "NANSEN file adapter",
  "description": "Declares a file adapter: which files it handles and where its implementation is in each language. An implementation reads a file into a value and writes a value to a file. Built-in adapters (json, text, mat, npy) need no declaration.",
  "type": "object",
  "required": ["schemaType", "schemaVersion", "id", "version", "implementations"],
  "additionalProperties": false,
  "properties": {
    "$schema": { "type": "string" },
    "schemaType": { "const": "nansen.fileAdapter" },
    "schemaVersion": { "type": "string", "pattern": "^0\\.1\\.\\d+$" },
    "id": { "type": "string", "pattern": "^[a-z][a-z0-9_]*(\\.[a-z][A-Za-z0-9_]*)*$" },
    "version": { "type": "string", "pattern": "^\\d+\\.\\d+\\.\\d+$" },
    "title": { "type": "string" },
    "description": { "type": "string" },
    "extensions": {
      "type": "array",
      "uniqueItems": true,
      "items": { "type": "string", "pattern": "^\\.[A-Za-z0-9.]+$" }
    },
    "dataType": { "type": "string" },
    "implementations": {
      "type": "object",
      "minProperties": 1,
      "additionalProperties": false,
      "properties": {
        "python": {
          "type": "string",
          "pattern": "^[A-Za-z_][A-Za-z0-9_.]*:[A-Za-z_][A-Za-z0-9_]*$",
          "description": "'module.path:ClassName'. The module is imported from the declaring module's folder. The class has read(path) and write(path, data)."
        },
        "matlab": {
          "type": "string",
          "pattern": "^[A-Za-z][A-Za-z0-9_.]*$",
          "description": "Name of a class with read(obj, path) and write(obj, path, data) methods, on the path while the declaring module is in use. With legacyFileAdapter: dev's class, or the package of dev's function-based adapter."
        }
      }
    },
    "legacyFileAdapter": {
      "type": "object",
      "required": ["kind"],
      "additionalProperties": false,
      "description": "The MATLAB implementation is a file adapter of NANSEN dev, imported unchanged (adapters.import, the legacy importer): a subclass of nansen.dataio.FileAdapter (kind class), read with load and written with save, or dev's function-based adapter (kind function), a folder with fileadapter.json whose read and write functions are named here. Only MATLAB reads and writes with it (nansen.legacy.FileAdapterShim); elsewhere it is adapter-unavailable.",
      "properties": {
        "kind": { "type": "string", "enum": ["class", "function"] },
        "read": { "type": "string", "pattern": "^[A-Za-z][A-Za-z0-9_.]*$", "description": "kind function: the function that reads a file, data = read(filename)." },
        "write": { "type": "string", "pattern": "^[A-Za-z][A-Za-z0-9_.]*$", "description": "kind function: the function that writes one, write(filename, data); none: the adapter only reads." }
      }
    }
  },
  "if": { "required": ["legacyFileAdapter"] },
  "then": { "properties": { "implementations": { "required": ["matlab"] } } }
}
